{"item_id":"we-v2.1.2-live-T091038Z-010","section":"Written Expression","solver_answer":"D","confidence":"HIGH","reason":"The verbs after \"to\" must be parallel: reduce, improve, and monitor. \"Monitoring\" is incorrect; it should be \"monitor.\"","ambiguity_detected":false,"suggested_correction":"monitor"}