{"item_id":"we-v2.1.2-live-T091038Z-009","section":"Written Expression","solver_answer":"D","confidence":"HIGH","reason":"The subject is the singular noun phrase “The network of sensors,” so the verb must be singular: “detects,” not “detect.”","ambiguity_detected":false,"suggested_correction":"detects"}