{"item_id":"we-v2.1.2-live-T091038Z-001","section":"Written Expression","solver_answer":"A","confidence":"HIGH","reason":"The singular subject “the sediment layer” requires the singular verb “preserves,” not “preserve.”","ambiguity_detected":false,"suggested_correction":"Because the sediment layer preserves pollen grains from earlier climates, researchers can reconstruct regional vegetation patterns with remarkable precision."}